{
  "$schema": "http://json-schema.org/draft-07/schema#",
  "$id": "https://github.com/likelylabs/news/schema/article.schema.json",
  "title": "News article",
  "description": "One self-contained article, both language versions in a single file. Written by the grok automation; consumed natively by the radio app's news section. See GROK.md and TIDINESS.md.",
  "type": "object",
  "additionalProperties": false,
  "required": ["id", "published_at", "category", "ai_generated", "en", "zh"],
  "properties": {
    "id": {
      "type": "string",
      "description": "Stable, unique. Format: YYYY-MM-DD-<slug>. Never reused, never changed after publish.",
      "pattern": "^[0-9]{4}-[0-9]{2}-[0-9]{2}-[a-z0-9]+(-[a-z0-9]+)*$"
    },
    "published_at": {
      "type": "string",
      "description": "ISO-8601 with Hong Kong offset (+08:00). Set once at first publish.",
      "pattern": "^[0-9]{4}-[0-9]{2}-[0-9]{2}T[0-9]{2}:[0-9]{2}:[0-9]{2}\\+08:00$"
    },
    "updated_at": {
      "type": "string",
      "description": "Set ONLY when correcting an already-published article. ISO-8601 +08:00.",
      "pattern": "^[0-9]{4}-[0-9]{2}-[0-9]{2}T[0-9]{2}:[0-9]{2}:[0-9]{2}\\+08:00$"
    },
    "category": {
      "type": "string",
      "description": "Single topical category from the controlled vocabulary.",
      "enum": ["politics", "business", "weather", "transport", "health", "crime", "community", "culture", "sport", "technology"]
    },
    "tags": {
      "type": "array",
      "description": "0-6 lowercase topical tags for filtering. Not a substitute for category.",
      "items": { "type": "string", "pattern": "^[a-z0-9]+(-[a-z0-9]+)*$" },
      "maxItems": 6,
      "uniqueItems": true
    },
    "breaking": {
      "type": "boolean",
      "description": "True only for genuinely urgent, high-impact stories. The app badges the story AND sends its headline + dek as a push notification to readers' phones (GROK.md §1c), so use it sparingly: a few a month at most, never more than one per run. Default false."
    },
    "ai_generated": {
      "type": "boolean",
      "description": "Always true. Drives the app's mandatory 'AI-generated' disclosure.",
      "const": true
    },
    "story_key": {
      "type": "string",
      "description": "Normalized identity of the underlying EVENT (not the headline wording), used for dedup against ledger.json. Same event across runs => same key.",
      "pattern": "^[a-z0-9]+(-[a-z0-9]+)*$"
    },
    "en": { "$ref": "#/definitions/localized" },
    "zh": { "$ref": "#/definitions/localized" }
  },
  "definitions": {
    "localized": {
      "type": "object",
      "additionalProperties": false,
      "required": ["headline", "dek", "body"],
      "properties": {
        "headline": {
          "type": "string",
          "description": "One line. <= 90 chars. No trailing punctuation, no ALL CAPS, no clickbait.",
          "minLength": 8,
          "maxLength": 90
        },
        "dek": {
          "type": "string",
          "description": "One-sentence standfirst/summary line shown under the headline in list + detail.",
          "minLength": 12,
          "maxLength": 220
        },
        "body": {
          "type": "array",
          "description": "Ordered paragraphs. Each item is one plain-text paragraph (no markdown, no HTML, no external links). App inserts native ads between paragraphs, so 3+ paragraphs is ideal.",
          "items": { "type": "string", "minLength": 1 },
          "minItems": 2
        }
      }
    }
  }
}
