{
  "id": "2026-09-03-dh-unregistered-injections-arrests",
  "published_at": "2026-09-03T09:09:00+08:00",
  "category": "health",
  "tags": ["health", "department-of-health", "dh", "police", "vaccines", "enforcement"],
  "breaking": false,
  "ai_generated": true,
  "story_key": "dh-wt1-unregistered-injections-sep2",
  "en": {
    "headline": "DH and police arrest two after seizing unregistered injections",
    "dek": "Health officials said more than 50 suspected unregistered injections were taken from over 13 premises in a joint operation tied to advertised multi-cancer WT1 shots.",
    "body": [
      "The Department of Health and the police have arrested two people and seized more than 50 suspected unregistered injections from over 13 premises, the department said on Wednesday, as officers continued an investigation into shots marketed as a Wilms tumour 1, or WT1, vaccine claimed to prevent multiple cancers.",
      "Assistant Director of Health Frank Chan said the injections recovered so far were mostly healthcare products such as vitamins and were classified as Part 1 poisons. Authorities had not found the WT1 product in the raids, he said, and there had been no reports of adverse reactions. The operation remained under way and further arrests were possible.",
      "Local reports said the searches, carried out over several days with police, included a medical centre in Lippo Sun Plaza on Canton Road in Tsim Sha Tsui. A 28-year-old clinic supervisor and a woman were arrested on suspicion of illegally selling or possessing unregistered pharmaceutical products and Part 1 poisons. The department has said WT1 is not a registered pharmaceutical product in Hong Kong and that it has found no matching registration with mainland or overseas regulators.",
      "Under the Pharmacy and Poisons Ordinance, illegally selling or possessing an unregistered pharmaceutical product or a Part 1 poison is punishable by a maximum fine of HK$100,000 and two years imprisonment per offence. The department has previously referred the advertising of the shots to the Medical Council and notified Customs over possible illegal importation. It has urged the public not to use unregistered products."
    ]
  },
  "zh": {
    "headline": "\u885e\u751f\u7f72\u806f\u540c\u8b66\u65b9\u62d8\u5169\u4eba \u6aa2\u903e50\u652f\u672a\u8a3b\u518a\u91dd\u5291",
    "dek": "\u885e\u751f\u7f72\u8868\u793a\uff0c\u5c31\u6709\u91ab\u7642\u4e2d\u5fc3\u5ba3\u50b3\u53ef\u9810\u9632\u591a\u7a2e\u764c\u75c7\u7684WT1\u91dd\u5291\uff0c\u806f\u540c\u8b66\u65b9\u641c\u67e5\u903e13\u500b\u8655\u6240\uff0c\u6aa2\u737250\u591a\u652f\u61f8\u7591\u672a\u7d93\u8a3b\u518a\u6ce8\u5c04\u5291\uff0c\u5169\u4eba\u88ab\u6355\u3002",
    "body": [
      "\u885e\u751f\u7f72\u5468\u4e09\u8868\u793a\uff0c\u7f72\u65b9\u806f\u540c\u8b66\u65b9\u63a1\u53d6\u884c\u52d5\uff0c\u5728\u8d85\u904e13\u500b\u8655\u6240\u6aa2\u737250\u591a\u652f\u61f8\u7591\u672a\u7d93\u8a3b\u518a\u6ce8\u5c04\u5291\uff0c\u4e26\u62d8\u6355\u5169\u4eba\u3002\u884c\u52d5\u8207\u6709\u91ab\u7642\u4e2d\u5fc3\u5728\u7db2\u4e0a\u5ba3\u50b3\u53ef\u63d0\u4f9b\u8072\u7a31\u80fd\u9810\u9632\u591a\u7a2e\u764c\u75c7\u7684WT1\u91dd\u5291\u6709\u95dc\uff0c\u7f72\u65b9\u6b63\u7e7c\u7e8c\u8abf\u67e5\u3002",
      "\u885e\u751f\u7f72\u52a9\u7406\u7f72\u9577\uff08\u85e5\u7269\uff09\u9673\u51cc\u5cef\u8868\u793a\uff0c\u76ee\u524d\u6aa2\u7372\u7684\u91dd\u5291\u591a\u6578\u5c6c\u7dad\u4ed6\u547d\u7b49\u4fdd\u5065\u88fd\u54c1\uff0c\u4e26\u5c6c\u7b2c1\u90e8\u6bd2\u85e5\u3002\u884c\u52d5\u4e2d\u66ab\u672a\u641c\u7372WT1\u88fd\u54c1\uff0c\u81f3\u4eca\u4ea6\u672a\u63a5\u7372\u5e02\u6c11\u63a5\u7a2e\u5f8c\u51fa\u73fe\u4e0d\u826f\u53cd\u61c9\u7684\u5831\u544a\u3002\u4ed6\u6307\u8abf\u67e5\u4ecd\u5728\u9032\u884c\uff0c\u4e0d\u6392\u9664\u518d\u6709\u4eba\u88ab\u6355\u3002",
      "\u5831\u9053\u6307\u9023\u65e5\u641c\u67e5\u5305\u62ec\u5c16\u6c99\u5632\u5ee3\u6771\u9053\u529b\u5bf6\u592a\u967d\u5ee3\u5834\u4e00\u9593\u91ab\u7642\u4e2d\u5fc3\uff0c\u88ab\u6355\u8005\u5305\u62ec\u4e00\u540d28\u6b72\u8a3a\u6240\u4e3b\u7ba1\u53ca\u4e00\u540d\u5973\u5b50\uff0c\u6d89\u5acc\u975e\u6cd5\u552e\u8ce3\u6216\u7ba1\u6709\u672a\u7d93\u8a3b\u518a\u85e5\u5291\u88fd\u54c1\u53ca\u7b2c1\u90e8\u6bd2\u85e5\u3002\u885e\u751f\u7f72\u65e9\u524d\u5f37\u8abf\uff0cWT1\u4e26\u975e\u9999\u6e2f\u8a3b\u518a\u85e5\u5291\u88fd\u54c1\uff0c\u4ea6\u672a\u767c\u73fe\u5167\u5730\u6216\u6d77\u5916\u85e5\u54c1\u76e3\u7ba1\u6a5f\u69cb\u6709\u76f8\u95dc\u8a3b\u518a\u7d00\u9304\u3002",
      "\u6839\u64da\u300a\u85e5\u5291\u696d\u53ca\u6bd2\u85e5\u689d\u4f8b\u300b\uff0c\u975e\u6cd5\u552e\u8ce3\u6216\u7ba1\u6709\u672a\u7d93\u8a3b\u518a\u85e5\u5291\u88fd\u54c1\u6216\u7b2c1\u90e8\u6bd2\u85e5\uff0c\u6bcf\u9805\u7f6a\u884c\u6700\u9ad8\u53ef\u8655\u7f70\u6b3e10\u842c\u5143\u53ca\u76e3\u7982\u5169\u5e74\u3002\u7f72\u65b9\u8f03\u65e9\u6642\u5df2\u5c07\u6709\u95dc\u5ee3\u544a\u8f49\u4ecb\u91ab\u52d9\u59d4\u54e1\u6703\uff0c\u4e26\u901a\u5831\u6d77\u95dc\u8ddf\u9032\u61f8\u7591\u975e\u6cd5\u9032\u53e3\uff0c\u540c\u6642\u547c\u7c72\u5e02\u6c11\u5207\u52ff\u4f7f\u7528\u672a\u7d93\u8a3b\u518a\u85e5\u5291\u88fd\u54c1\u3002"
    ]
  }
}
